anime_id,name,genre,type,episodes,text
1359,Nikutai Ten&#039;i,"Hentai, Yuri",OVA,2,"Nikutai Ten&#039;i [TYPE] OVA [GENRE] Hentai, Yuri [EP] 2"
12783,Sora no Otoshimono Final: Eternal My Master,"Comedy, Ecchi, Harem, Sci-Fi, Shounen, Supernatural",Movie,1,"Sora no Otoshimono Final: Eternal My Master [TYPE] Movie [GENRE] Comedy, Ecchi, Harem, Sci-Fi, Shounen, Supernatural [EP] 1"
28981,Ame-iro Cocoa,"Comedy, Slice of Life",TV,12,"Ame-iro Cocoa [TYPE] TV [GENRE] Comedy, Slice of Life [EP] 12"
1369,Detective Conan OVA 01: Conan vs. Kid vs. Yaiba,"Adventure, Comedy, Mystery, Shounen",OVA,1,"Detective Conan OVA 01: Conan vs. Kid vs. Yaiba [TYPE] OVA [GENRE] Adventure, Comedy, Mystery, Shounen [EP] 1"
25647,Sabagebu! Specials,"Action, Comedy, Military, Shoujo",Special,6,"Sabagebu! Specials [TYPE] Special [GENRE] Action, Comedy, Military, Shoujo [EP] 6"
1138,Medarot,"Adventure, Comedy, Sci-Fi, Shounen",TV,52,"Medarot [TYPE] TV [GENRE] Adventure, Comedy, Sci-Fi, Shounen [EP] 52"
8995,Tales of Symphonia The Animation: Sekai Tougou-hen,"Action, Adventure, Fantasy, Magic, Martial Arts, Shounen",OVA,3,"Tales of Symphonia The Animation: Sekai Tougou-hen [TYPE] OVA [GENRE] Action, Adventure, Fantasy, Magic, Martial Arts, Shounen [EP] 3"
11083,Nurarihyon no Mago: Sennen Makyou Recaps,"Action, Demons, Shounen, Supernatural",Special,2,"Nurarihyon no Mago: Sennen Makyou Recaps [TYPE] Special [GENRE] Action, Demons, Shounen, Supernatural [EP] 2"
31138,Overlord: Ple Ple Pleiades,"Action, Comedy, Fantasy, Magic",Special,8,"Overlord: Ple Ple Pleiades [TYPE] Special [GENRE] Action, Comedy, Fantasy, Magic [EP] 8"
21177,Nobunaga the Fool,"Action, Historical, Mecha, Sci-Fi",TV,24,"Nobunaga the Fool [TYPE] TV [GENRE] Action, Historical, Mecha, Sci-Fi [EP] 24"
6330,Shakugan no Shana: Friagne to Marianne no Naze Nani Shana! Nandemo Shitsumonbako!,"Comedy, Fantasy, Supernatural",Special,8,"Shakugan no Shana: Friagne to Marianne no Naze Nani Shana! Nandemo Shitsumonbako! [TYPE] Special [GENRE] Comedy, Fantasy, Supernatural [EP] 8"
129,Gensoumaden Saiyuuki,"Adventure, Comedy, Drama, Shounen, Supernatural",TV,50,"Gensoumaden Saiyuuki [TYPE] TV [GENRE] Adventure, Comedy, Drama, Shounen, Supernatural [EP] 50"
22433,Break Blade,"Action, Fantasy, Mecha, Military, Shounen",TV,12,"Break Blade [TYPE] TV [GENRE] Action, Fantasy, Mecha, Military, Shounen [EP] 12"
12117,Detective Conan Movie 16: The Eleventh Striker,"Adventure, Comedy, Mystery, Police, Shounen, Sports",Movie,1,"Detective Conan Movie 16: The Eleventh Striker [TYPE] Movie [GENRE] Adventure, Comedy, Mystery, Police, Shounen, Sports [EP] 1"
3515,Saint Seiya: Meiou Hades Elysion-hen,"Action, Fantasy, Shounen, Super Power",OVA,6,"Saint Seiya: Meiou Hades Elysion-hen [TYPE] OVA [GENRE] Action, Fantasy, Shounen, Super Power [EP] 6"
1954,Rayearth,"Action, Adventure, Fantasy",OVA,3,"Rayearth [TYPE] OVA [GENRE] Action, Adventure, Fantasy [EP] 3"
10531,Detective Conan Magic File 5: Niigata - Tokyo Omiyage Capriccio,"Adventure, Comedy, Mystery, Police, Shounen",OVA,1,"Detective Conan Magic File 5: Niigata - Tokyo Omiyage Capriccio [TYPE] OVA [GENRE] Adventure, Comedy, Mystery, Police, Shounen [EP] 1"
30567,Teekyuu 5,"Comedy, Shounen, Sports",TV,12,"Teekyuu 5 [TYPE] TV [GENRE] Comedy, Shounen, Sports [EP] 12"
31368,Grisaia no Rakuen Specials,Ecchi,Special,5,Grisaia no Rakuen Specials [TYPE] Special [GENRE] Ecchi [EP] 5
3674,Sayonara Zetsubou Sensei Jo: Zetsubou Shoujo Senshuu,"Comedy, Parody, School",Special,1,"Sayonara Zetsubou Sensei Jo: Zetsubou Shoujo Senshuu [TYPE] Special [GENRE] Comedy, Parody, School [EP] 1"
472,To Heart,"Drama, Harem, Romance, School, Slice of Life",TV,13,"To Heart [TYPE] TV [GENRE] Drama, Harem, Romance, School, Slice of Life [EP] 13"
1890,Clover,"Drama, Fantasy, Music, Sci-Fi, Shoujo",Music,1,"Clover [TYPE] Music [GENRE] Drama, Fantasy, Music, Sci-Fi, Shoujo [EP] 1"
797,Hanaukyou Maid-tai OVA,"Comedy, Ecchi, Harem, Romance",OVA,3,"Hanaukyou Maid-tai OVA [TYPE] OVA [GENRE] Comedy, Ecchi, Harem, Romance [EP] 3"
24855,Girlfriend (Kari),"School, Slice of Life",TV,12,"Girlfriend (Kari) [TYPE] TV [GENRE] School, Slice of Life [EP] 12"
5041,Guin Saga,"Adventure, Fantasy",TV,26,"Guin Saga [TYPE] TV [GENRE] Adventure, Fantasy [EP] 26"
1614,Captain Tsubasa: Road to 2002,"Action, Shounen, Sports",TV,52,"Captain Tsubasa: Road to 2002 [TYPE] TV [GENRE] Action, Shounen, Sports [EP] 52"
10933,R-15 OVA,"Adventure, Comedy, Ecchi, Harem, Parody, Romance",OVA,1,"R-15 OVA [TYPE] OVA [GENRE] Adventure, Comedy, Ecchi, Harem, Parody, Romance [EP] 1"
1648,UFO Princess Valkyrie 4: Toki to Yume to Ginga no Utage,"Comedy, Romance, Sci-Fi",OVA,2,"UFO Princess Valkyrie 4: Toki to Yume to Ginga no Utage [TYPE] OVA [GENRE] Comedy, Romance, Sci-Fi [EP] 2"
1601,Red Garden,"Drama, Mystery",TV,22,"Red Garden [TYPE] TV [GENRE] Drama, Mystery [EP] 22"
1253,Saint Seiya: Meiou Hades Meikai-hen,"Action, Adventure, Demons, Fantasy, Sci-Fi, Shounen, Super Power",OVA,12,"Saint Seiya: Meiou Hades Meikai-hen [TYPE] OVA [GENRE] Action, Adventure, Demons, Fantasy, Sci-Fi, Shounen, Super Power [EP] 12"
10249,Toaru Majutsu no Index-tan II,"Comedy, Parody",Special,2,"Toaru Majutsu no Index-tan II [TYPE] Special [GENRE] Comedy, Parody [EP] 2"
576,Magikano,"Comedy, Fantasy, Harem, Magic, Romance, Shounen",TV,13,"Magikano [TYPE] TV [GENRE] Comedy, Fantasy, Harem, Magic, Romance, Shounen [EP] 13"
642,Ichigo 100%: Koi ga Hajimaru?! Satsuei Gasshuku - Yureru Kokoro ga Higashi e Nishi e,"Ecchi, Romance, Shounen",Special,1,"Ichigo 100%: Koi ga Hajimaru?! Satsuei Gasshuku - Yureru Kokoro ga Higashi e Nishi e [TYPE] Special [GENRE] Ecchi, Romance, Shounen [EP] 1"
11237,Hidamari Sketch x SP,"Comedy, School, Slice of Life",Special,2,"Hidamari Sketch x SP [TYPE] Special [GENRE] Comedy, School, Slice of Life [EP] 2"
5835,Hanasakeru Seishounen,"Drama, Romance, Shoujo",TV,39,"Hanasakeru Seishounen [TYPE] TV [GENRE] Drama, Romance, Shoujo [EP] 39"
421,Stratos 4,"Comedy, Military, Sci-Fi, Shounen",TV,13,"Stratos 4 [TYPE] TV [GENRE] Comedy, Military, Sci-Fi, Shounen [EP] 13"
16317,Ishida to Asakura,"Comedy, School, Seinen",TV,12,"Ishida to Asakura [TYPE] TV [GENRE] Comedy, School, Seinen [EP] 12"
483,Kurau Phantom Memory,"Action, Drama, Sci-Fi, Space, Super Power",TV,24,"Kurau Phantom Memory [TYPE] TV [GENRE] Action, Drama, Sci-Fi, Space, Super Power [EP] 24"
466,One Piece: Taose! Kaizoku Ganzack,"Action, Adventure, Comedy, Fantasy, Shounen, Super Power",OVA,1,"One Piece: Taose! Kaizoku Ganzack [TYPE] OVA [GENRE] Action, Adventure, Comedy, Fantasy, Shounen, Super Power [EP] 1"
3089,The Sky Crawlers,"Drama, Military",Movie,1,"The Sky Crawlers [TYPE] Movie [GENRE] Drama, Military [EP] 1"
23447,"Ano Natsu de Matteru: Bokutachi wa Koukou Saigo no Natsu wo Sugoshinagara, Ano Natsu de Matteiru.","Comedy, Drama, Romance, Sci-Fi, Slice of Life",Special,1,"Ano Natsu de Matteru: Bokutachi wa Koukou Saigo no Natsu wo Sugoshinagara, Ano Natsu de Matteiru. [TYPE] Special [GENRE] Comedy, Drama, Romance, Sci-Fi, Slice of Life [EP] 1"
1501,Kaleido Star: Good da yo! Goood!!,Comedy,OVA,1,Kaleido Star: Good da yo! Goood!! [TYPE] OVA [GENRE] Comedy [EP] 1
14827,D.C.III: Da Capo III,"Drama, Ecchi, Romance, School",TV,13,"D.C.III: Da Capo III [TYPE] TV [GENRE] Drama, Ecchi, Romance, School [EP] 13"
1111,Vandread: Gekitou-hen,"Action, Adventure, Comedy, Ecchi, Mecha, Sci-Fi, Space",OVA,1,"Vandread: Gekitou-hen [TYPE] OVA [GENRE] Action, Adventure, Comedy, Ecchi, Mecha, Sci-Fi, Space [EP] 1"
30925,Gatchaman Crowds Insight: Inbound,"Adventure, Sci-Fi",ONA,1,"Gatchaman Crowds Insight: Inbound [TYPE] ONA [GENRE] Adventure, Sci-Fi [EP] 1"
8310,Magic Kaito,"Adventure, Comedy, Romance, Shounen",Special,12,"Magic Kaito [TYPE] Special [GENRE] Adventure, Comedy, Romance, Shounen [EP] 12"
17115,Pokemon Best Wishes! Season 2: Episode N,"Action, Adventure, Comedy, Fantasy, Kids",TV,14,"Pokemon Best Wishes! Season 2: Episode N [TYPE] TV [GENRE] Action, Adventure, Comedy, Fantasy, Kids [EP] 14"
19193,Ghost in the Shell: Arise - Border:3 Ghost Tears,"Mecha, Police, Psychological, Sci-Fi",Movie,1,"Ghost in the Shell: Arise - Border:3 Ghost Tears [TYPE] Movie [GENRE] Mecha, Police, Psychological, Sci-Fi [EP] 1"
15951,Amagami SS+ Plus Picture Drama,Romance,Special,2,Amagami SS+ Plus Picture Drama [TYPE] Special [GENRE] Romance [EP] 2
9213,Kowarekake no Orgel,"Drama, Music, Sci-Fi, Slice of Life",OVA,1,"Kowarekake no Orgel [TYPE] OVA [GENRE] Drama, Music, Sci-Fi, Slice of Life [EP] 1"
789,Shinigami no Ballad.,"Drama, Fantasy, Psychological, Supernatural",TV,6,"Shinigami no Ballad. [TYPE] TV [GENRE] Drama, Fantasy, Psychological, Supernatural [EP] 6"
1609,Mai-Otome Zwei,"Action, Magic",OVA,4,"Mai-Otome Zwei [TYPE] OVA [GENRE] Action, Magic [EP] 4"
2135,"Sora no Iro, Mizu no Iro",Hentai,OVA,2,"Sora no Iro, Mizu no Iro [TYPE] OVA [GENRE] Hentai [EP] 2"
18617,Girls und Panzer der Film,"Military, School",Movie,1,"Girls und Panzer der Film [TYPE] Movie [GENRE] Military, School [EP] 1"
3456,Candy☆Boy: Side Story For Archive,"Romance, School, Shoujo Ai",ONA,1,"Candy☆Boy: Side Story For Archive [TYPE] ONA [GENRE] Romance, School, Shoujo Ai [EP] 1"
21573,Senki Zesshou Symphogear GX: Believe in Justice and Hold a Determination to Fist.,"Action, Music, Sci-Fi",TV,13,"Senki Zesshou Symphogear GX: Believe in Justice and Hold a Determination to Fist. [TYPE] TV [GENRE] Action, Music, Sci-Fi [EP] 13"
447,Weiß Kreuz,"Action, Drama, Shounen",TV,25,"Weiß Kreuz [TYPE] TV [GENRE] Action, Drama, Shounen [EP] 25"
12695,Tight-rope,"Romance, Shounen Ai",OVA,2,"Tight-rope [TYPE] OVA [GENRE] Romance, Shounen Ai [EP] 2"
2031,Shining Tears X Wind,"Action, Adventure, Fantasy, Magic",TV,13,"Shining Tears X Wind [TYPE] TV [GENRE] Action, Adventure, Fantasy, Magic [EP] 13"
1045,Elf wo Karu Mono-tachi,"Adventure, Comedy, Ecchi, Fantasy, Magic, Shounen",TV,12,"Elf wo Karu Mono-tachi [TYPE] TV [GENRE] Adventure, Comedy, Ecchi, Fantasy, Magic, Shounen [EP] 12"
5670,GA: Geijutsuka Art Design Class,"Comedy, School, Seinen, Slice of Life",TV,12,"GA: Geijutsuka Art Design Class [TYPE] TV [GENRE] Comedy, School, Seinen, Slice of Life [EP] 12"
2608,Wangan Midnight,"Action, Cars, Seinen, Sports",TV,26,"Wangan Midnight [TYPE] TV [GENRE] Action, Cars, Seinen, Sports [EP] 26"
2589,Black Cat Special,"Action, Comedy, Shounen",Special,1,"Black Cat Special [TYPE] Special [GENRE] Action, Comedy, Shounen [EP] 1"
1232,Saber Marionette R,"Action, Comedy, Harem, Mecha, Sci-Fi",OVA,3,"Saber Marionette R [TYPE] OVA [GENRE] Action, Comedy, Harem, Mecha, Sci-Fi [EP] 3"
113,Uchuu no Stellvia,"Action, Romance, Sci-Fi, Space",TV,26,"Uchuu no Stellvia [TYPE] TV [GENRE] Action, Romance, Sci-Fi, Space [EP] 26"
31498,Pan de Peace!,"Comedy, School, Slice of Life",TV,13,"Pan de Peace! [TYPE] TV [GENRE] Comedy, School, Slice of Life [EP] 13"
18139,Tonari no Seki-kun,"Comedy, School, Seinen",TV,21,"Tonari no Seki-kun [TYPE] TV [GENRE] Comedy, School, Seinen [EP] 21"
31715,Working!!!: Lord of the Takanashi,"Comedy, Romance, Slice of Life",Special,1,"Working!!!: Lord of the Takanashi [TYPE] Special [GENRE] Comedy, Romance, Slice of Life [EP] 1"
31973,Mobile Suit Gundam Thunderbolt,"Action, Drama, Mecha, Military, Sci-Fi, Space",ONA,4,"Mobile Suit Gundam Thunderbolt [TYPE] ONA [GENRE] Action, Drama, Mecha, Military, Sci-Fi, Space [EP] 4"
13263,Fate/Zero: Onegai! Einzbern Soudanshitsu,Comedy,Special,6,Fate/Zero: Onegai! Einzbern Soudanshitsu [TYPE] Special [GENRE] Comedy [EP] 6
286,B&#039;T X,"Adventure, Mecha, Sci-Fi, Shounen",TV,25,"B&#039;T X [TYPE] TV [GENRE] Adventure, Mecha, Sci-Fi, Shounen [EP] 25"
251,Kyou kara Maou!,"Adventure, Comedy, Demons, Fantasy, Shoujo",TV,78,"Kyou kara Maou! [TYPE] TV [GENRE] Adventure, Comedy, Demons, Fantasy, Shoujo [EP] 78"
6112,Shin Koihime†Musou,"Comedy, Ecchi, Fantasy, Historical",TV,12,"Shin Koihime†Musou [TYPE] TV [GENRE] Comedy, Ecchi, Fantasy, Historical [EP] 12"
32245,Kuromukuro,"Action, Mecha, Sci-Fi",TV,26,"Kuromukuro [TYPE] TV [GENRE] Action, Mecha, Sci-Fi [EP] 26"
5460,Detective Conan Movie 13: The Raven Chaser,"Action, Mystery, Police, Shounen",Movie,1,"Detective Conan Movie 13: The Raven Chaser [TYPE] Movie [GENRE] Action, Mystery, Police, Shounen [EP] 1"
11705,Dragon Age: Blood Mage no Seisen,"Action, Fantasy",Movie,1,"Dragon Age: Blood Mage no Seisen [TYPE] Movie [GENRE] Action, Fantasy [EP] 1"
17725,Magical☆Star Kanon 100%,"Magic, Music, Shounen",OVA,1,"Magical☆Star Kanon 100% [TYPE] OVA [GENRE] Magic, Music, Shounen [EP] 1"
1445,Mach GoGoGo,"Adventure, Cars, Shounen, Sports",TV,52,"Mach GoGoGo [TYPE] TV [GENRE] Adventure, Cars, Shounen, Sports [EP] 52"
4078,Kyou no 5 no 2 Kagai Jugyou: Mizukake,"Comedy, Ecchi, School, Seinen",Special,1,"Kyou no 5 no 2 Kagai Jugyou: Mizukake [TYPE] Special [GENRE] Comedy, Ecchi, School, Seinen [EP] 1"
25649,Junjou Romantica 3,"Comedy, Drama, Romance, Shounen Ai",TV,12,"Junjou Romantica 3 [TYPE] TV [GENRE] Comedy, Drama, Romance, Shounen Ai [EP] 12"
21473,Persona 3 the Movie 2: Midsummer Knight&#039;s Dream,"Action, Fantasy, Seinen, Supernatural",Movie,1,"Persona 3 the Movie 2: Midsummer Knight&#039;s Dream [TYPE] Movie [GENRE] Action, Fantasy, Seinen, Supernatural [EP] 1"
9888,Shinryaku! Ika Musume Specials,Comedy,Special,2,Shinryaku! Ika Musume Specials [TYPE] Special [GENRE] Comedy [EP] 2
31630,"Gyakuten Saiban: Sono &quot;Shinjitsu&quot;, Igi Ari!","Comedy, Drama, Mystery, Police",TV,24,"Gyakuten Saiban: Sono &quot;Shinjitsu&quot;, Igi Ari! [TYPE] TV [GENRE] Comedy, Drama, Mystery, Police [EP] 24"
418,Ranma ½: Chuugoku Nekonron Daikessen! Okite Yaburi no Gekitou-hen!!,"Adventure, Comedy, Shounen",Movie,1,"Ranma ½: Chuugoku Nekonron Daikessen! Okite Yaburi no Gekitou-hen!! [TYPE] Movie [GENRE] Adventure, Comedy, Shounen [EP] 1"
979,Street Fighter Zero The Animation,"Action, Drama, Martial Arts, Shounen, Super Power",Movie,1,"Street Fighter Zero The Animation [TYPE] Movie [GENRE] Action, Drama, Martial Arts, Shounen, Super Power [EP] 1"
11341,Tantei Opera Milky Holmes Dai 2 Maku,"Comedy, Mystery, Super Power",TV,12,"Tantei Opera Milky Holmes Dai 2 Maku [TYPE] TV [GENRE] Comedy, Mystery, Super Power [EP] 12"
9544,Biohazard: Damnation,"Action, Horror, Sci-Fi",Movie,1,"Biohazard: Damnation [TYPE] Movie [GENRE] Action, Horror, Sci-Fi [EP] 1"
1317,Eyeshield 21: Maboroshi no Golden Bowl,"Shounen, Sports",Movie,1,"Eyeshield 21: Maboroshi no Golden Bowl [TYPE] Movie [GENRE] Shounen, Sports [EP] 1"
23037,Bakumatsu Rock,"Action, Comedy, Historical, Music, Shoujo",TV,12,"Bakumatsu Rock [TYPE] TV [GENRE] Action, Comedy, Historical, Music, Shoujo [EP] 12"
6399,Higashi no Eden: Falling Down,Music,Music,1,Higashi no Eden: Falling Down [TYPE] Music [GENRE] Music [EP] 1
1050,Bobobo-bo Bo-bobo,"Adventure, Comedy, Sci-Fi, Shounen",TV,76,"Bobobo-bo Bo-bobo [TYPE] TV [GENRE] Adventure, Comedy, Sci-Fi, Shounen [EP] 76"
11889,The iDOLM@STER: 765 Pro to Iu Monogatari,"Comedy, Drama, Music",Special,1,"The iDOLM@STER: 765 Pro to Iu Monogatari [TYPE] Special [GENRE] Comedy, Drama, Music [EP] 1"
6425,Weiß Survive,"Comedy, Ecchi, Game",TV,16,"Weiß Survive [TYPE] TV [GENRE] Comedy, Ecchi, Game [EP] 16"
8098,Soukyuu no Fafner: Dead Aggressor - Heaven and Earth,"Action, Drama, Mecha, Military, Sci-Fi",Movie,1,"Soukyuu no Fafner: Dead Aggressor - Heaven and Earth [TYPE] Movie [GENRE] Action, Drama, Mecha, Military, Sci-Fi [EP] 1"
665,JoJo no Kimyou na Bouken: Adventure,"Adventure, Drama, Fantasy, Horror, Shounen, Supernatural, Vampire",OVA,7,"JoJo no Kimyou na Bouken: Adventure [TYPE] OVA [GENRE] Adventure, Drama, Fantasy, Horror, Shounen, Supernatural, Vampire [EP] 7"
2743,Mobile Suit Gundam Seed: Seed Supernova - Tanekyara Gekijou,"Comedy, Parody",Special,4,"Mobile Suit Gundam Seed: Seed Supernova - Tanekyara Gekijou [TYPE] Special [GENRE] Comedy, Parody [EP] 4"
6581,Sengoku Basara: Setonai no Gekitotsu! Hi wo Fuku Umi no Daiyousai - Fugaku!!,"Action, Historical, Martial Arts, Samurai",Special,1,"Sengoku Basara: Setonai no Gekitotsu! Hi wo Fuku Umi no Daiyousai - Fugaku!! [TYPE] Special [GENRE] Action, Historical, Martial Arts, Samurai [EP] 1"
31564,Sansha Sanyou,"Comedy, School, Slice of Life",TV,12,"Sansha Sanyou [TYPE] TV [GENRE] Comedy, School, Slice of Life [EP] 12"
2604,Sky Girls,"Mecha, Military, Sci-Fi",TV,26,"Sky Girls [TYPE] TV [GENRE] Mecha, Military, Sci-Fi [EP] 26"
967,Hokuto no Ken,"Action, Drama, Martial Arts, Sci-Fi, Shounen",TV,109,"Hokuto no Ken [TYPE] TV [GENRE] Action, Drama, Martial Arts, Sci-Fi, Shounen [EP] 109"
30375,Starmyu,"Music, School, Slice of Life",TV,12,"Starmyu [TYPE] TV [GENRE] Music, School, Slice of Life [EP] 12"
16405,Boku no Imouto wa &quot;Osaka Okan&quot;,Comedy,TV,12,Boku no Imouto wa &quot;Osaka Okan&quot; [TYPE] TV [GENRE] Comedy [EP] 12
62,D.C.: Da Capo,"Drama, Harem, Magic, Romance",TV,26,"D.C.: Da Capo [TYPE] TV [GENRE] Drama, Harem, Magic, Romance [EP] 26"
3604,Hidamari Sketch x 365,"Comedy, School, Slice of Life",TV,13,"Hidamari Sketch x 365 [TYPE] TV [GENRE] Comedy, School, Slice of Life [EP] 13"
12437,Yuri Seijin Naoko-san (2012),Comedy,OVA,1,Yuri Seijin Naoko-san (2012) [TYPE] OVA [GENRE] Comedy [EP] 1
5959,Mizugi Kanojo: The Animation,Hentai,OVA,4,Mizugi Kanojo: The Animation [TYPE] OVA [GENRE] Hentai [EP] 4
20221,Minami-ke Natsuyasumi,"Comedy, Slice of Life",OVA,1,"Minami-ke Natsuyasumi [TYPE] OVA [GENRE] Comedy, Slice of Life [EP] 1"
785,Otaku no Video,"Comedy, Drama, Historical, Magic, Mecha, Sci-Fi",OVA,2,"Otaku no Video [TYPE] OVA [GENRE] Comedy, Drama, Historical, Magic, Mecha, Sci-Fi [EP] 2"
9924,Shukufuku no Campanella: La Campanella Della Benedizione,"Comedy, Ecchi, Fantasy",OVA,1,"Shukufuku no Campanella: La Campanella Della Benedizione [TYPE] OVA [GENRE] Comedy, Ecchi, Fantasy [EP] 1"
3537,Cleavage,Hentai,OVA,2,Cleavage [TYPE] OVA [GENRE] Hentai [EP] 2
303,Aa! Megami-sama!: Chichaitte Koto wa Benri da ne,"Comedy, Magic, Supernatural",TV,48,"Aa! Megami-sama!: Chichaitte Koto wa Benri da ne [TYPE] TV [GENRE] Comedy, Magic, Supernatural [EP] 48"
345,Eikoku Koi Monogatari Emma,"Drama, Historical, Romance, Seinen, Slice of Life",TV,12,"Eikoku Koi Monogatari Emma [TYPE] TV [GENRE] Drama, Historical, Romance, Seinen, Slice of Life [EP] 12"
145,Kareshi Kanojo no Jijou,"Comedy, Drama, Romance, School, Shoujo, Slice of Life",TV,26,"Kareshi Kanojo no Jijou [TYPE] TV [GENRE] Comedy, Drama, Romance, School, Shoujo, Slice of Life [EP] 26"
4794,Pokemon: Pikachu no Dokidoki Kakurenbo,"Adventure, Comedy, Fantasy, Kids",Movie,1,"Pokemon: Pikachu no Dokidoki Kakurenbo [TYPE] Movie [GENRE] Adventure, Comedy, Fantasy, Kids [EP] 1"
9690,Densetsu no Yuusha no Densetsu: Iris Report,"Action, Adventure, Fantasy, Magic, Shounen",Special,1,"Densetsu no Yuusha no Densetsu: Iris Report [TYPE] Special [GENRE] Action, Adventure, Fantasy, Magic, Shounen [EP] 1"
13115,Hakuouki Reimeiroku,"Action, Drama, Historical, Josei, Samurai, Supernatural",TV,12,"Hakuouki Reimeiroku [TYPE] TV [GENRE] Action, Drama, Historical, Josei, Samurai, Supernatural [EP] 12"
2563,Aria The OVA: Arietta,"Fantasy, Sci-Fi, Shounen, Slice of Life",OVA,1,"Aria The OVA: Arietta [TYPE] OVA [GENRE] Fantasy, Sci-Fi, Shounen, Slice of Life [EP] 1"
507,Gravitation: Lyrics of Love,"Comedy, Romance, Shoujo, Shounen Ai",OVA,2,"Gravitation: Lyrics of Love [TYPE] OVA [GENRE] Comedy, Romance, Shoujo, Shounen Ai [EP] 2"
1164,Mahou Senshi Louie,"Adventure, Comedy, Fantasy, Magic, Shounen",TV,24,"Mahou Senshi Louie [TYPE] TV [GENRE] Adventure, Comedy, Fantasy, Magic, Shounen [EP] 24"
296,Dragon Drive,"Action, Adventure, Comedy, Fantasy, School, Sci-Fi, Shounen",TV,38,"Dragon Drive [TYPE] TV [GENRE] Action, Adventure, Comedy, Fantasy, School, Sci-Fi, Shounen [EP] 38"
230,Air Master,"Action, Comedy, Martial Arts, Seinen",TV,27,"Air Master [TYPE] TV [GENRE] Action, Comedy, Martial Arts, Seinen [EP] 27"
1504,Macross Flash Back 2012,"Drama, Mecha, Military, Sci-Fi",OVA,1,"Macross Flash Back 2012 [TYPE] OVA [GENRE] Drama, Mecha, Military, Sci-Fi [EP] 1"
2386,One Piece: Yume no Soccer Ou!,"Comedy, Fantasy, Shounen, Sports",Movie,1,"One Piece: Yume no Soccer Ou! [TYPE] Movie [GENRE] Comedy, Fantasy, Shounen, Sports [EP] 1"
13183,Fate/Zero Remix,"Action, Fantasy, Supernatural",Special,2,"Fate/Zero Remix [TYPE] Special [GENRE] Action, Fantasy, Supernatural [EP] 2"
21373,Freezing Vibration Specials,"Action, Comedy, Ecchi",Special,6,"Freezing Vibration Specials [TYPE] Special [GENRE] Action, Comedy, Ecchi [EP] 6"
1347,Bubblegum Crisis,"Adventure, Mecha, Sci-Fi, Shounen",OVA,8,"Bubblegum Crisis [TYPE] OVA [GENRE] Adventure, Mecha, Sci-Fi, Shounen [EP] 8"
2784,Gift: Eternal Rainbow Special,"Comedy, Ecchi, Harem, Magic, Romance",Special,1,"Gift: Eternal Rainbow Special [TYPE] Special [GENRE] Comedy, Ecchi, Harem, Magic, Romance [EP] 1"
7411,Kanojo x Kanojo x Kanojo: Sanshimai to no DokiDoki Kyoudou Seikatsu,"Harem, Hentai",OVA,3,"Kanojo x Kanojo x Kanojo: Sanshimai to no DokiDoki Kyoudou Seikatsu [TYPE] OVA [GENRE] Harem, Hentai [EP] 3"
12017,Tiger &amp; Bunny Movie 2: The Rising,"Action, Comedy, Mystery, Super Power",Movie,1,"Tiger &amp; Bunny Movie 2: The Rising [TYPE] Movie [GENRE] Action, Comedy, Mystery, Super Power [EP] 1"
1543,Yoake Mae yori Ruriiro na: Crescent Love,"Comedy, Romance, School, Sci-Fi",TV,12,"Yoake Mae yori Ruriiro na: Crescent Love [TYPE] TV [GENRE] Comedy, Romance, School, Sci-Fi [EP] 12"
30056,Amagi Brilliant Park: Wakuwaku Mini Theater - Rakugaki Backstage,Comedy,Special,7,Amagi Brilliant Park: Wakuwaku Mini Theater - Rakugaki Backstage [TYPE] Special [GENRE] Comedy [EP] 7
454,.hack//Gift,"Comedy, Fantasy, Game",OVA,1,".hack//Gift [TYPE] OVA [GENRE] Comedy, Fantasy, Game [EP] 1"
18495,Kitakubu Katsudou Kiroku,"Comedy, School, Slice of Life",TV,12,"Kitakubu Katsudou Kiroku [TYPE] TV [GENRE] Comedy, School, Slice of Life [EP] 12"
15609,"Kono Naka ni Hitori, Imouto ga Iru!: Ani, Imouto, Koibito","Comedy, Ecchi, Harem, Romance, School, Seinen",OVA,1,"Kono Naka ni Hitori, Imouto ga Iru!: Ani, Imouto, Koibito [TYPE] OVA [GENRE] Comedy, Ecchi, Harem, Romance, School, Seinen [EP] 1"
13171,Wasurenagumo,"Comedy, Supernatural",Movie,1,"Wasurenagumo [TYPE] Movie [GENRE] Comedy, Supernatural [EP] 1"
30300,"High School DxD New: Oppai, Tsutsumimasu!","Comedy, Demons, Ecchi, Romance, School",OVA,1,"High School DxD New: Oppai, Tsutsumimasu! [TYPE] OVA [GENRE] Comedy, Demons, Ecchi, Romance, School [EP] 1"
1514,UFO Princess Valkyrie 3: Seiresetsu no Hanayome,"Comedy, Magic, Romance, Sci-Fi",OVA,6,"UFO Princess Valkyrie 3: Seiresetsu no Hanayome [TYPE] OVA [GENRE] Comedy, Magic, Romance, Sci-Fi [EP] 6"
8339,Kachou no Koi,"Comedy, Romance, Yaoi",OVA,1,"Kachou no Koi [TYPE] OVA [GENRE] Comedy, Romance, Yaoi [EP] 1"
559,RahXephon Interlude: Her and Herself/Thatness and Thereness,"Drama, Psychological, Sci-Fi",OVA,1,"RahXephon Interlude: Her and Herself/Thatness and Thereness [TYPE] OVA [GENRE] Drama, Psychological, Sci-Fi [EP] 1"
8457,Yozakura Quartet: Hoshi no Umi,"Action, Comedy, Magic, Shounen, Super Power, Supernatural",OVA,3,"Yozakura Quartet: Hoshi no Umi [TYPE] OVA [GENRE] Action, Comedy, Magic, Shounen, Super Power, Supernatural [EP] 3"
10187,HenSemi (TV),"Comedy, Ecchi, Seinen",TV,13,"HenSemi (TV) [TYPE] TV [GENRE] Comedy, Ecchi, Seinen [EP] 13"
127,Gate Keepers,"Action, Comedy, Fantasy, Mecha, Sci-Fi, Shounen",TV,24,"Gate Keepers [TYPE] TV [GENRE] Action, Comedy, Fantasy, Mecha, Sci-Fi, Shounen [EP] 24"
10197,Nyanpire The Animation,"Comedy, Supernatural",TV,12,"Nyanpire The Animation [TYPE] TV [GENRE] Comedy, Supernatural [EP] 12"
5504,Shinkyoku Soukai Polyphonica Crimson S,"Drama, Fantasy, Music, Romance, School",TV,12,"Shinkyoku Soukai Polyphonica Crimson S [TYPE] TV [GENRE] Drama, Fantasy, Music, Romance, School [EP] 12"
318,Hand Maid May,"Comedy, Ecchi, Harem, Romance, Sci-Fi",TV,10,"Hand Maid May [TYPE] TV [GENRE] Comedy, Ecchi, Harem, Romance, Sci-Fi [EP] 10"
26023,Haiyore! Nyaruko-san F,"Comedy, Parody, Romance, Sci-Fi",OVA,1,"Haiyore! Nyaruko-san F [TYPE] OVA [GENRE] Comedy, Parody, Romance, Sci-Fi [EP] 1"
6172,Layton Kyouju to Eien no Utahime,Mystery,Movie,1,Layton Kyouju to Eien no Utahime [TYPE] Movie [GENRE] Mystery [EP] 1
6291,Full Metal Panic! The Second Raid Episode 000,"Action, Adventure, Mecha, Military",Special,1,"Full Metal Panic! The Second Raid Episode 000 [TYPE] Special [GENRE] Action, Adventure, Mecha, Military [EP] 1"
32094,Reikenzan: Hoshikuzu-tachi no Utage,"Comedy, Fantasy, Magic",TV,12,"Reikenzan: Hoshikuzu-tachi no Utage [TYPE] TV [GENRE] Comedy, Fantasy, Magic [EP] 12"
595,X OVA,"Drama, Fantasy, Mystery, Romance, Supernatural",OVA,1,"X OVA [TYPE] OVA [GENRE] Drama, Fantasy, Mystery, Romance, Supernatural [EP] 1"
30709,Kamisama Hajimemashita: Kako-hen,"Comedy, Demons, Fantasy, Shoujo, Supernatural",OVA,4,"Kamisama Hajimemashita: Kako-hen [TYPE] OVA [GENRE] Comedy, Demons, Fantasy, Shoujo, Supernatural [EP] 4"
19391,Shingeki no Kyojin Picture Drama,"Comedy, Parody",Special,9,"Shingeki no Kyojin Picture Drama [TYPE] Special [GENRE] Comedy, Parody [EP] 9"
8624,Digimon Xros Wars,"Action, Adventure, Comedy, Fantasy, Shounen",TV,30,"Digimon Xros Wars [TYPE] TV [GENRE] Action, Adventure, Comedy, Fantasy, Shounen [EP] 30"
1091,Mobile Suit Gundam II: Soldiers of Sorrow,"Action, Drama, Mecha, Military, Sci-Fi, Space",Movie,1,"Mobile Suit Gundam II: Soldiers of Sorrow [TYPE] Movie [GENRE] Action, Drama, Mecha, Military, Sci-Fi, Space [EP] 1"
504,Fatal Fury: The Motion Picture,"Action, Adventure, Drama, Martial Arts, Romance, Shounen",Movie,1,"Fatal Fury: The Motion Picture [TYPE] Movie [GENRE] Action, Adventure, Drama, Martial Arts, Romance, Shounen [EP] 1"
3269,.hack//G.U. Trilogy,"Action, Fantasy, Game, Sci-Fi",Movie,1,".hack//G.U. Trilogy [TYPE] Movie [GENRE] Action, Fantasy, Game, Sci-Fi [EP] 1"
3918,Resort Boin,Hentai,OVA,3,Resort Boin [TYPE] OVA [GENRE] Hentai [EP] 3
31500,High School Fleet,"Action, Military, School",TV,12,"High School Fleet [TYPE] TV [GENRE] Action, Military, School [EP] 12"
